{
  "contractVersion": "transaction@0.1.0",
  "schemaId": "transaction",
  "schemaVersion": 1,
  "baseRevision": 42,
  "source": {
    "kind": "command-plan",
    "commandId": "command.runtime.guarded"
  },
  "effects": [
    {
      "contractVersion": "effect@0.1.0",
      "schemaId": "effect",
      "schemaVersion": 1,
      "type": "set",
      "target": {
        "domainId": "state-domain.core.world",
        "path": "/doors/main/state"
      },
      "value": "open",
      "guard": {
        "contractVersion": "condition@0.1.0",
        "schemaId": "condition",
        "schemaVersion": 1,
        "type": "condition-ref",
        "conditionId": "condition.core.allow-transaction"
      }
    }
  ]
}
