{
  "contractVersion": "transaction@0.1.0",
  "schemaId": "transaction",
  "schemaVersion": 1,
  "baseRevision": 42,
  "source": {
    "kind": "command-plan",
    "commandId": "command.runtime.multi"
  },
  "effects": [
    {
      "contractVersion": "effect@0.1.0",
      "schemaId": "effect",
      "schemaVersion": 1,
      "type": "set",
      "target": {
        "domainId": "state-domain.core.world",
        "path": "/doors/main/state"
      },
      "value": "open"
    },
    {
      "contractVersion": "effect@0.1.0",
      "schemaId": "effect",
      "schemaVersion": 1,
      "type": "increment",
      "target": {
        "domainId": "state-domain.core.clock",
        "path": "/tick"
      },
      "delta": 1
    }
  ]
}
