{
  "contractVersion": "transaction@0.1.0",
  "schemaId": "transaction",
  "schemaVersion": 1,
  "transactionId": "transaction.runtime.open-main-door",
  "baseRevision": 42,
  "source": {
    "kind": "command-plan",
    "commandId": "command.runtime.open-main-door"
  },
  "effects": [
    {
      "contractVersion": "effect@0.1.0",
      "schemaId": "effect",
      "schemaVersion": 1,
      "type": "set",
      "target": {
        "domainId": "state-domain.core.world",
        "path": "/doors/main/state"
      },
      "value": "open"
    }
  ]
}
