{
  "contractVersion": "transaction@0.1.0",
  "schemaId": "transaction",
  "schemaVersion": 1,
  "baseRevision": 42,
  "source": {
    "kind": "system",
    "systemId": "scheduler.core.tick"
  },
  "effects": [
    {
      "contractVersion": "effect@0.1.0",
      "schemaId": "effect",
      "schemaVersion": 1,
      "type": "set",
      "target": {
        "domainId": "state-domain.core.world",
        "path": "/doors/main/state"
      },
      "value": "open"
    }
  ]
}
